{
  "id": "F-001",
  "source_id": "S-001",
  "claim": "Telemonitored patients had a 21% relative reduction in 30-day readmission versus matched controls",
  "outcome": "readmission",
  "direction": "reduction",
  "evidence": "Multicenter cohort, n=2,140; adjusted HR 0.79 (0.68-0.92)",
  "theme_id": "T-01"
}
